Year (Latin),Year (English),Event (Latin),Event (English)
1166,1166,Bellum Trōiānum inceptum est.,The Trojan War is started.
1156,1156,Bellum Trōiānum perfectum est.,The Trojan War is ended.
1,753,Urbs Roma condita est.,The city of Rome is founded.
2,752,Feminae Sabinae a viris Romanis raptae sunt.,The Rape of the Sabine Women by the men of Rome.
7,747,"Ultimus Rex Sabinōrum, Titus Tatius, mortuus est","The Last king of the Sabines, Titus Tatius dies"
38,716,Romulus deus factus est,Romulus is deified
39,715,Numa Pompilius rex Romanus factus est,Numa Pompilius is made king of Rome
82,672,Tullus Hostilius rex Romanus factus est,Tullus Hostilius is made king of Rome
114,640,Ancus Marcius rex Romanus factus est,Ancus Marcius is made king of Rome
138,616,Lucius Tarquinius Priscus rex Romanus factus est,Lucius Tarquinius Priscus is made king of Rome
154,600,Cloaca Maxima aedificata est,The Cloaca Maxima is built
176,578,Servius Tullius rex Romanus factus est,Servius Tullius is made king of Rome
220,534,Lucius Tarquinius Superbus rex Romanus factus est,Lucius Tarquinius Superbus is made king of Rome
245,509,Templum Iovī Optimō Maximō in monte Capitolīnō aedificatum est,The Temple to Jupiter Optimus Maximus is built on the Capitoline Hill
245,509,Res publica Romana constituta est,The Roman Republic is established
259,495,"Tarquinius Superbus, ultimus rex Romae, necātus est","Tarquin the Proud, the last king of Rome, is killed"
259,495,Aedes Mercuriī in Monte Aventinō prope Circo Maximo aedificatum est,The Temple of Mercury is built on the Aventine Hill near to the Circus Maximus
271,483,"Virgō Vestalis, nomine Oppia, incestum accusata, occisa est","A Vestal Virgin, named Oppia, accused of inchastity, is put to death"
296,458,Cincinnatus dictator factus est ut contrā Aequōs pugnāret.,Cincinnati is made dictator in order to fight the Aequi.
305,449,"Leges, nomine Duodecim Tabulae, scriptae et in rostrīs positae sunt",The Laws called twelve tables are written and publice displayed on the rostra
309,445,Matrimonium inter patricios plebeiosque nondum vetatum est,Marriage between Patricians and Plebians is made legal
358,396,Milites Romanī primum salarium accipiunt,Roman Soldiers first receive a salary
370,384,Templum Junoni Monetae in monte Capitolīnō sacrātum est,The Temple of Juno Moneta is dedicated
388,366,"Primus Consul plebeius, Lucius Sextius Lateranus, electus est","The first plebeian consul, Lucius Sextius Lateranus, is elected"
431,323,"Alexander Magnus, rex Macedoniae, Babyloniae mortuus est","Alexander the Great, king of Macendonia, died in Babylon"
447,307,"Ap. Claudius Caecus primam viam, Viam Appiam, aquaeductumque, Aquam Appiam, aedificavit","Appius Claudius Caecus builds the first road, the Appian Way, and the first aqueduct, the Aqua Appia"
454,300,Plebeibus sacerdotes fieri nondum vetati sunt,Plebeians are allowed to become priests
482,272,"Bellum contrā Pyrrhum, regem Epirī, perfectum est","The War against Pyrrhus, king of Epirus, ends"
490,264,Primum Bellum Punicum contrā Carthaginem inceptum est,The First Punic War against Carthage begins
513,241,Roma Siciliam vincit et provinciam facit,Rome conquers Sicily and makes it a province
536,218,Secundum Bellum Punicum contrā Carthaginem inceptum est,The Second Punic War against Carthage begins
537,217,Q. Fabius Maximus dictator exercitum Romanum contra Carthaginem duxit ratione strategicā fatigationis et proelia negante dictā 'Fabiānā' utēns,"Quintus Fabius Maximus Verrucosus, a dictator, led the Roman army against the Carthaginians using the so-called Fabian Strategy of exhaustion and denying battle"
538,216,Hannibal Exercitum Romanum in proeliō Cannae caecidit,Hannibal defeats Rome at the battle of Cannae
538,216,Templum Concordiae consecratum est,The Temple of Concord is consecrated
549,205,Romānī a Oraculō Sibyllinō Magnam Matrem in pantheum deōrum Romanum adoptare monītī sunt ut Carthaginem destruerent,"Rome is told to adopt the Great Mother into the Roman Pantheon by the Sibylline Oracle, so that Rome destroy Carthage"
552,202,Scipio Africanus Hannibalem et Carthaginensēs apud Zamam vicit,Scipio Africanus defeats Hannibal and Carthaginians at Zama
553,201,Roma Hispaniam a Carthagine cepit et in formam provinciae redegit ,Rome takes Hispania from Carthage 
585,169,"Ennius poeta, qui poema Annales de origine Roma usque ad vitam Catonis scripserat, mortuus est","The poet Ennius, who had written the poem Annales about the origins of Rome up to the life of Cato, died "
595,159,"P. Terentius Afer, poeta et libertus qui multas comoedias scripserat, vicesimo sexto aetatis suae annō mortuus est","Terence, a poet and a freedman who wrote comedies, died at the age of 25"
605,149,"Cato Maior, qui insigniter ""Carthaginem delendam esse"" dixerat, mortuus est","Cato the Elder, famous for saying ""Carthage must be Destroyed"", died"
611,143,"Claudia virgo Vestalis patrem suum, Claudium Pulchrum, qui triumphum celebrabat, a plebeis eum oppugnantibus defendit ",The Vestal Virgin Claudia defends her father Claudius Pulcher from the plebs who attacked him while he was celebrating his triumph
632,122,Gaius Tiberius Gracchus ab Optimatibus necātus est propter leges populares quas ipse Tribunus plebis anno praeterito promovit,"Gaius Tiberius Gracchus, Tribune of the Plebs, is killed by the Optimates because of laws he had passed the previous year as Tribune of the Plebs."
633,121,"L. Coelius Antipater, qui historiam de secundō bellō Punicō scripserat, mortuus est","Lucius Coelius Antipater, who had written a history of the Second Punic War, died"
641,113,"Tres Virgines Vestales, nomine Aemilia, Marcia, Liciniaque, propter incestum occisae sunt","Three Vestal Virgins, called Aemilia, Marcia, and Licinia, are killed for violating their oath of chastity"
647,107,"Gaius Marius legiones Romanas reformavit. Militēs, quī postquam arma ferre ipsī debebant, ""mulī Mariānī"" dictī sunt.","Gaius Marius reformed the Roman Military. His soldiers, who afterward had to carry their own weapons and equipment, were called ""Marius' mules."""
663,91,"Bellum sociale, inter sociōs Romae Italōs et Rem publicam Romānam, inceptum est","The Social War, between Rome and its Italian allies, begins"
666,88,Sulla armātus pomerium transiit,Sulla crosses the Pomerium under arms
668,86,Gaius Marius mortuus est,Gaius Marius died
672,82,Sulla sē dictatorem facit,Sulla makes himself dictator
681,73,Spartacus servos liberat et in bello contrā Rōmam ducit,Spartacus frees slaves and leads them in rebellion against Rome
681,73,"Fabia, Vestalis Maxima, ā Cicerōne criminis incestī cum Catalinā accusata est sed innocēns iudicāta et nōn punita est","Fabia, the Chief Vestal Virgin, is prosecuted by Cicero for violating her vows of chastity with Cataline but is proclaimed innocent and not punished"
688,66,Piratae Ciliciani a Pompeiō Magnō victi sunt,The Cilician Pirates are defeated by Pompey the Great
691,63,Iulius Caesar pontifex maximus electus est,Julius Caesar is elected Pontifex Maximus
691,63,Cicero coniurationem Catalinae inhibit,Cicero stops the Cataline Conspiracy
691,63,C. Sallustius Crispus librum Bellum Catalinae scribit,Sallust writes the book The Cataline War
691,63,Pompeius Magnus Ierusaleum vicit,Pompey defeats the rebellion in Jerusalem
694,60,"Primus triumviratus inter Crassum, Pompeium Magnum, et Iulium Caesarem factus est ","The first triumvirate is formed among Crassus, Pompey the Great, and Julius Caesar"
695,59,Iulius Caesar cum Marcō Bibulō consul est,Julius Caesar is consul with Marcus Bibulus
696,58,Caesar Helvetiōs oppugnat et Bellum Gallicum incipit.,Caesar attacks the Helvetii begining the Gallic War.
696,58,Terentia multās epistulās marito suō Ciceronī qui in exilio erat scribit ,Terentia writes many letters to her husband Cicero who was in exile
699,55,Iulius Caesar ad Britanniam it. Est prīmus Rōmānus quī ad illam īnsulam advenit. ,Julius Caesar goes to Britain. He is the first Roman to go to the island.
700,54,"Catullus poeta, qui centum et sedecim poema scripserat, mortuus esse dicitur","The poet Catullua, who wrote 116 poems, is said to have died"
701,53,Crassus a Parthis occisus est apud Carrhas,Crassus is killed by the Parthians at Carrhae
702,52,Vercingetorix a Caesare victus et captus est in proelio apud Alesiam,Vercingetorix is defeated and captured by Caesar at the battle of Alesia
705,49,"""Alea iacta est."" Caesar flūmen Rubicōnem transit et bellum civīle contrā Pompeium et Senātum Rōmānum incipit.","""The die is cast."" Caesar crosses the river Rubicon and begins the civil war against Pompey and the Roman Senate."
705,49,Caesar Rōmae dictator sē facit.,Caesar makes himself dictator in Rome
706,48,Proelium apud Pharsālum inter Caesarem et Pompeium pugnatum est. Caesar vincit.,The Battle of Pharsalus between Caesar and Pompey is fought. Caesar wins.
706,48,"Pharnaces, rex Ponti et filius Mithradatis VI a Iulio Caesare facile victus est","Pharnaces, king of Pontus and son of Mithradates VI is easily defeated by Caesar"
707,47,Cleopatra VII regina Aegypta fit postquam Ptolemaios XIII a Iulio Caesare occisus est,Cleopatra VII becomes queen of Egypt after Ptolemy XIII is killed by Caesar
708,46,"Factio Pompeii Magni, a Catone Minore ducta, in Africa victa est","The Pompeiian Faction, led by Cato the Younger, is defeated in Africa"
709,45,"Titus Labienus, olim legatus Caesaris in Galliā, mortuus est contrā Caesarem pugnāns apud Mundam in Hispania","Caesar's former legate in Gaul, Titus Labienus, dies fighting against Caesar at the Battle of Munda in Hispania"
709,45,Kalendarium Iulianum adoptatum est,The Julian Calendar is adopted
710,44,Iulius Caesar dictatorem perpetuum declaratus est,Julius Caesar is declared Dictator for life
710,44,Idibus Martiis Gaius Iūlius Caesar ā senatoribus viginti et trēs vulneribus in curiā confossus est,"On the Ides of March, Julius Caesar is stabbed to death with 23 wounds by a group of senators"
711,43,"Marcus Antonius, Marcus Aemilius Lepidus, et Gaius Octavius secundum triumviratum formavērunt","Mark Antony, Marcus Aemilius Lepidus, and Octavian form the second triumvirate"
711,43,Aulus Hirtius octāvum et ultimum librum Bellī Gallicī Caesaris perfecit,Aulus Hirtius finishes Book VII of Caesar's Gallic Wars
711,43,Cicero in praescriptiōne secundī triumvirātī decapitatus est,Cicero is beheaded in the prescriptions of the second triumvirate.
712,42,Hortensia triumviratum secundum oratiōne praeclarā persuadet ut vectigal feminarum pecuniosarum obroget,Hortensia in a famous speech persuades the Second Triumvirate to repeal a tax on wealthy women
712,42,Brutus Cassiusque in proeliō apud Philippōs occiduntur,Brutus and Cassius are killed at the battle of Philippi
712,42,"Livia, quae posthac uxor Augusti futūra esset, flilium Tiberium Claudium Neronem parit.","Livia, who would later be the future wife of Augustus, gives birth to Tiberius."
723,31,Proelium navale apud Actium inter Anontii Cleopatraeque copias et copias Octavianī pugnatum est.,The naval Battle of Actium between the forces of Antony and Cleopatra and those of Octavian takes place.
724,30,Marcus Antonius Cleopatraque sē interfecērunt.,Marc Antony and Cleopatra commit suicide.
725,29,Bellum Cantabrium in quō Rōmānī totam partem reliquam Hispaniam ā Gallīs capiunt incepit.,"The Cantabrian War, in which the Romans take control of the entire remaining part of Celtic Iberia begins."
726,28,Templum Apollinis in monte Palatino aedificatum est.,The Temple of Apollo on the Palatine hill is built.
727,27,Augustus princeps fit et tribuniciam potestam perpetuam accipit.,"Augustus becomes ""Princeps"" (Emperor) taking the power of the Tribunes for life."
727,27,"Marcus Terentius Varro, qui magnum numerum librōrum de rebus variis vitae Romanae scripsit, mortuus est.","Marcus Terentius Varro, who had written a large number of books about many topics of Roman life, dies."
729,25,Augustus provinciam Galatiam imperiō Rōmānō addidit.,Augustus annexes the province of Galatia.
731,23,"Nepos Augusti, nomine Marcellus, fīlius Octaviae quem Augustus volēbat post sē imperāre, mortuus est.","Augustus's nephew, Marcellus, son of Octavia, whom Augustus wanted to rule after him, dies."
733,21,"Filia Augusti, nomine Iulia, a Marco Agrippa in matrimonium ducta est.","Julia, the daughter of Augustus, marries Marcus Agrippa."
735,19,"Vergilius mortuus est. Post mortem Virgili, Augustus carmen epicum eius, Aeneidos, edidit.","Vergil dies. After his death, Augustus publishes Virgil's epic poem, the Aeneid."
735,19,Carmen nomine Ars Poetica ā Horatiō scriptum est.,Horace writes the poem Ars Poetica.
742,12,Marcus Agrippa morbo mortuus est,Marcus Agrippa dies of fever
743,11,"Filia Augusti, nomine Iulia, a Tiberio in matrimonium ducta est.","Julia, the daughter of Augustus, marries Tiberius."
743,11,Theatrum Marcellī aedificatum est.,The Theater of Marcellus is built.
745,9,Pannonia in provinciam Illyricum inclusit.,Pannonia is absorbed by the province of Illyricum.
746,8,"Q. Horatius Flaccus poeta, qui Carmen Saeculare scripserat, mortuus est.","The poet Horace who wrote the Carmen Saeculare, dies."
745,9,"Ultimus annus descriptus librō Liviī, Ab Urbe Condita.",The last year covered by Livy's Ab Urbe Condita.
748,6,"Tiberius ad īnsulam Rhodum abcessit, quia imperium noluit.","Tiberius, not wanting imperium, retires to the island of Rhodes."
752,2,"Augustus ""Pater Patriae"" ā senātū nōminātus est.","Augustus is declared ""Pater Patriae"" (Father of the Fatherland) by the senate."